{
  "ticket_id": "T-002",
  "review_round": 1,
  "source_hash": "aede1d50ae57df18de5cc942e7c43f7550fa2262bd1ab67c8cb9a45e7116e763",
  "verification_id": "4bccd3966ec74313a0a0a0cfdc6cd9b9",
  "verdict": "PASS",
  "criteria": [
    {"id": "AT-001", "status": "PASS", "critical": true},
    {"id": "AT-002", "status": "PASS", "critical": true},
    {"id": "AC-1-SINGLE-ENTRY", "status": "PASS", "critical": true,
     "source": "Killed the Hub (PID 43336), confirmed 3100 released, then ran `cmd /c start-hub.cmd` with no other terminal input: 3100 listening within 8s under PID 30932; GET / returned HTTP 200 with <title>MCP Hub</title>; GET /api/gateway/status returned state=running pid=45720 matching the CLI Runtime PID. Full transcript in .harness/review-notes/T-002.md",
     "limitations": "Browser launch confirmed only as process presence (chrome 18 / msedge 5 already running), not attributed to a specific new tab; the UI-button path was exercised through the automated check rather than a fresh click-through of the .cmd flow"},
    {"id": "AC-2-REAL-AVAILABILITY", "status": "PASS", "critical": true,
     "source": "Automated `check.py lifecycle` on the real Gateway: pair_calls both tools callable, stop button -> UI 'Gateway 已停止' + unavailable() confirms initialize refused, start button -> 'Gateway 運作中' + both tools callable again, restart button -> same. Manual: cold POST /api/gateway/start 13.7s -> state=running pid=24108 with 'Readiness (/health/ready): ready'; POST /api/gateway/stop -> state=stopped with 3050 released and all 1mcp processes gone. Port-occupied start returns state=error, never Running (see AC-4).",
     "limitations": "Tool calls are proven to traverse the Gateway (fixture gateway_url is http://127.0.0.1:3050/mcp; gateway log grew 8958 bytes during a check.py run; manual tools/call against 127.0.0.1:3050/mcp returned 'The sum of 2 and 3 is 5.' and 'The sum of 40 and 2 is 42.'). Downstream-layer health is not part of this criterion: with the http downstream killed, the Gateway still reports running and /health/ready still 200 while the http tool returns -32603. That is T-007 scope, recorded as a known limitation."},
    {"id": "AC-3-TAB-CLOSE", "status": "PASS", "critical": true,
     "source": "check_002 calls page.close() before the final pair_calls(); both services returned their expected results. Independently: killing the whole Hub process (PID 32148) left the Gateway supervisor and runtime alive with 3050 still listening, so the admin UI has no ownership of the Gateway process.",
     "limitations": "None material. launch.js uses detached + unref, so the server is independent of the launcher."},
    {"id": "AC-4-NO-FOREIGN-KILL", "status": "PASS", "critical": true,
     "source": "Scenario 1, port squatter: an unrelated node process (PID 42288) held 127.0.0.1:3050; POST /api/gateway/start returned HTTP 200 in 36.5s with state=error and message 'startup timed out after 30 seconds: port 3050 may be occupied by another process, or the Gateway is unresponsive'; PID 42288 still alive and still OwningProcess of 3050. Scenario 2, unconfirmable identity: server.pid overwritten with '99999'; GET status returned state=unknown with CLI error 'Runtime PID metadata is malformed; retained for manual recovery'; POST stop returned state=error 'stop command sent, but a running process was detected'; real runtime 44020 stayed alive and 3050 stayed listening. Recovery: after clearing processes and server.pid, start returned state=running in 18.8s and server.pid was regenerated.",
     "limitations": "Cleanup safety verified directly: with server.pid deleted and a squatter (PID 20996) owning 3050, `1mcp --config-dir ... --stop` returned in 1.0s with 'No runtime is running in this Runtime Scope', exit 0, leaving the squatter alive and still owning the port. PID-file corruption was tested by rewriting the file, not by killing the process and letting it go stale; no case where a valid PID file pointed at an unrelated live process was exercised."},
    {"id": "AC-5-LOCAL-ONLY", "status": "UNVERIFIED", "critical": false,
     "source": "Get-NetTCPConnection -LocalPort 3100 -State Listen shows LocalAddress 127.0.0.1 only; config.js hardcodes hub.host = '127.0.0.1' with a comment stating the admin page is local-only by design and never configurable to 0.0.0.0. From the host: http://100.119.224.46:3100/ and https://alvin.tail63d20f.ts.net:3100/ both refused. From WSL tailnet node alvin-1 (100.79.209.7): http://100.119.224.46:3100/ returned curl 000. `tailscale serve status` and `tailscale funnel status` both list exactly one rule, 'https://alvin.tail63d20f.ts.net (tailnet only) |-- /mcp proxy http://127.0.0.1:3050/mcp'; port 3100 never appears in the proxy configuration.",
     "limitations": "The criterion names the iPhone's private remote path and that device was NOT tested; this entry is deliberately left UNVERIFIED and non-critical rather than promoted to PASS on inference. Two independent mechanisms are verified and neither admits a tailnet route to 3100: the listener binds 127.0.0.1 only, and neither `tailscale serve status` nor `tailscale funnel status` contains any rule for 3100 (the sole rule is 'https://alvin.tail63d20f.ts.net (tailnet only) |-- /mcp proxy http://127.0.0.1:3050/mcp', tailnet only, no Funnel). A probe from WSL tailnet node alvin-1 (100.79.209.7) to http://100.119.224.46:3100/ returned curl 000. What remains unobserved is the device-side click itself. A delegated reviewer independently flagged the gap; the coordinator agrees and is recording it rather than closing it. OBLIGATION: close this before T-010 by having the operator open the admin URL from the iPhone over Tailscale and record connection-refused, then promote this criterion to PASS with that evidence. Also untested: whether another local user account can reach 127.0.0.1:3100 (recorded as F-04)."},
    {"id": "REVIEWER-BLOCKING-ADJUDICATED", "status": "PASS", "critical": false,
     "source": "A delegated reviewer (collaboration/runs/review-T002-r1, nemotron-3-ultra) raised 6 blocking findings. Two were disproved by direct test: (a) 'pair_calls bypasses the Gateway' is false, Checks.__init__ binds self.gateway to cfg['gateway_url'] = http://127.0.0.1:3050/mcp; (b) 'timeout cleanup --stop may kill a foreign process' is false, the CLI no-ops without a valid PID file. Four are recorded as non-blocking F-01..F-04 in .harness/review-notes/T-002.md. None of them changes a T-002 acceptance criterion.",
     "limitations": "The delegated reviewer is a free-tier model and its reasoning was treated as a hypothesis list, not as a verdict; every blocking claim was independently reproduced or refuted by the coordinator."}
  ],
  "findings": []
}
