{
  "ticket_id": "T-003",
  "review_round": 1,
  "source_hash": "1ca4c1033e776efb65c44d3bf74cc0c8d9a10b4a0e6a681ad45d113f50b43e9a",
  "verification_id": "6e1a80b4df7c4619ac34fcb9f5a75659",
  "verdict": "PASS",
  "criteria": [
    {
      "id": "AT-001",
      "status": "PASS",
      "critical": true,
      "evidence": "Harness receipt f2a22557b88846388c1f3ff3ae258dd0 reports AT-001 PASSED with returncode 0."
    },
    {
      "id": "AT-002",
      "status": "PASS",
      "critical": true,
      "evidence": "Harness receipt f2a22557b88846388c1f3ff3ae258dd0 reports AT-002 PASSED with returncode 0."
    },
    {
      "id": "AT-003",
      "status": "PASS",
      "critical": true,
      "evidence": "Harness receipt f2a22557b88846388c1f3ff3ae258dd0 reports AT-003 PASSED with returncode 0."
    },
    {
      "id": "AC-INPUT-VALIDATION",
      "status": "PASS",
      "critical": true,
      "evidence": "Playwright entered an invalid service name through the real management page; the field error became visible and the before/after /api/services response was byte-identical.",
      "source": "VT02_INVALID_FORM_REJECTED_PRESERVED_DRAFT; app/public/app.js and app/src/config-store.js",
      "limitations": "This negative case covered an invalid name; credential-bearing and malformed URL cases are covered by the product unit tests and API smoke, not repeated in this browser probe."
    },
    {
      "id": "AC-APPLY-CONFIRMATION",
      "status": "PASS",
      "critical": true,
      "evidence": "Playwright captured the real confirmation text containing Gateway restart and possible interruption of in-progress tool calls; dismissing it produced no POST /api/config/apply.",
      "source": "VT03_APPLY_CONFIRM_TEXT_AND_CANCEL_NO_REQUEST; app/public/app.js",
      "limitations": "The browser probe intentionally cancelled before a second apply, because AT-003 already exercised the confirmed real apply path."
    },
    {
      "id": "AC-DRAFT-APPLY-PERSIST",
      "status": "PASS",
      "critical": true,
      "evidence": "AT-003 added one stdio and one Streamable HTTP service through the UI, confirmed both apply results, reloaded the page, and real Gateway calls returned the fixture results; the isolated mcp.json contained both transport types afterward.",
      "source": "Harness AT-003 receipt; isolated external runtime D:/AI-Lab/MCP-HUB-acceptance/gateway-config-t003-harness-20261005-r2",
      "limitations": "Editing an already persisted row is T-004; this ticket evidence covers staged form changes and explicit apply."
    },
    {
      "id": "AC-FAILURE-RECOVERY",
      "status": "PASS",
      "critical": true,
      "evidence": "The real buildServer/ConfigStore apply route was exercised with controlled restart outcomes: recovery success restored last-good and identified old configuration; recovery failure retained both errors and last-good; first apply without last-good explicitly reported no recoverable version.",
      "source": "VT03_RECOVERY_SUCCESS_EXPLICIT_OLD_CONFIG; VT03_RECOVERY_FAILURE_RETains_BOTH_ERRORS; VT03_FIRST_APPLY_NO_RECOVERABLE_VERSION",
      "limitations": "The recovery matrix controls the restart seam to deterministically cover all three branches; the Gateway process identity and port-conflict safety path was independently exercised in the T-002 real lifecycle evidence."
    }
  ],
  "findings": []
}
